{
  "question_matches": [
    {
      "claim_ids": [
        "claim-sampling-complete-programs-and-then-fine-tuning-them-with-evolutionary-search-an--98bcfa809814",
        "claim-ansor-s-learned-cost-model-predicts-tensor-program-throughput-accurately-enough--f02bf9f271c3"
      ],
      "evidence_ids": [
        "evidence-complete-program-finetuning--c5ad4810e2b9",
        "evidence-cost-model-accuracy--1d4f8a6b9c20"
      ],
      "question_id": "question-ml-compiler-optimization",
      "rationale": "The source directly shows machine learning improving compiler optimization decisions through a learned cost model that ranks tensor-program candidates during evolutionary search, reducing the need for expensive hardware measurement while guiding candidate selection.",
      "relevance": "high"
    },
    {
      "claim_ids": [
        "claim-ansor-s-two-level-sketch-and-annotation-representation-expands-tensor-program-se--99c86cd5cc6d",
        "claim-ansor-can-find-high-performance-tensor-programs-outside-the-search-spaces-covere--55b9a6e7dea6",
        "claim-ansor-outperforms-existing-search-frameworks-and-manual-libraries-on-single-oper--6b650490cda3",
        "claim-ansor-can-match-autotvm-s-performance-with-much-less-search-time-by-jointly-opti--1286fb5da9f9"
      ],
      "evidence_ids": [
        "evidence-hierarchical-derivation-rules--4b7e91c2a6d0",
        "evidence-operator-subgraph-speedups--e83f2a19c047",
        "evidence-search-time-savings--0a9b3e7d2f15"
      ],
      "question_id": "question-autotuning",
      "rationale": "The source directly evaluates an autotuning compiler approach against manually designed templates, static search spaces, vendor libraries, and AutoTVM, showing where broader automated search and task scheduling improve performance and search efficiency.",
      "relevance": "high"
    },
    {
      "claim_ids": [
        "claim-ansor-s-two-level-sketch-and-annotation-representation-expands-tensor-program-se--99c86cd5cc6d",
        "claim-ansor-can-find-high-performance-tensor-programs-outside-the-search-spaces-covere--55b9a6e7dea6"
      ],
      "evidence_ids": [
        "evidence-hierarchical-derivation-rules--4b7e91c2a6d0"
      ],
      "question_id": "question-ir-design",
      "rationale": "The source is relevant to compiler representation design because Ansor's sketch-and-annotation representation separates high-level program structures from low-level choices, making a large tensor-program search space enumerable and tunable. It is not primarily an intermediate-representation paper, so the match is limited.",
      "relevance": "medium"
    }
  ],
  "schema_version": "question_relevance_mapping_v1",
  "source_id": "source-ansor-generating-high-performance-tensor-programs-for-deep-learning--839fb7edb551",
  "warnings": []
}
